{
  "$schema": "https://json-schema.org/draft/2020-12/schema",
  "title": "Kit 1 report",
  "type": "object",
  "properties": {
    "schema_version": {
      "const": "kit1-ops-v5"
    },
    "kind": {
      "const": "report"
    },
    "run_id": {
      "type": "string",
      "minLength": 1
    },
    "created_utc": {
      "anyOf": [
        {
          "type": "string",
          "pattern": "^\\d{4}-\\d{2}-\\d{2}T\\d{2}:\\d{2}:\\d{2}(?:\\.\\d{1,6})?Z$"
        },
        {
          "type": "null"
        }
      ]
    },
    "synthetic": {
      "type": "boolean"
    },
    "kit_version": {
      "type": "string",
      "minLength": 1
    },
    "build_revision": {
      "anyOf": [
        {
          "type": "string",
          "minLength": 1
        },
        {
          "type": "null"
        }
      ]
    },
    "sources_revision": {
      "anyOf": [
        {
          "type": "string",
          "minLength": 1
        },
        {
          "type": "null"
        }
      ]
    },
    "mapping_revision": {
      "anyOf": [
        {
          "type": "string",
          "minLength": 1
        },
        {
          "type": "null"
        }
      ]
    },
    "fixture_revision": {
      "anyOf": [
        {
          "type": "string",
          "minLength": 1
        },
        {
          "type": "null"
        }
      ]
    },
    "producer": {
      "anyOf": [
        {
          "type": "string",
          "minLength": 1
        },
        {
          "type": "null"
        }
      ]
    },
    "reviewer": {
      "anyOf": [
        {
          "type": "string",
          "minLength": 1
        },
        {
          "type": "null"
        }
      ]
    },
    "review_ref": {
      "anyOf": [
        {
          "type": "string",
          "minLength": 1
        },
        {
          "type": "null"
        }
      ]
    },
    "user_style_review": {
      "enum": [
        "offen",
        "bestätigt",
        "abgelehnt"
      ]
    },
    "evidence": {
      "type": "array",
      "items": {
        "type": "object",
        "properties": {
          "id": {
            "type": "string",
            "minLength": 1
          },
          "path": {
            "type": "string",
            "minLength": 1
          },
          "sha256": {
            "type": "string",
            "pattern": "^[a-f0-9]{64}$"
          },
          "kind": {
            "enum": [
              "screenshot",
              "video",
              "telemetry",
              "log",
              "coverage",
              "sources",
              "config",
              "fixture",
              "tiles",
              "derivation",
              "region"
            ]
          },
          "origin": {
            "enum": [
              "runtime",
              "data",
              "synthetic"
            ]
          }
        },
        "required": [
          "id",
          "path",
          "sha256",
          "kind",
          "origin"
        ],
        "additionalProperties": false
      },
      "minItems": 0
    },
    "measurements": {
      "type": "array",
      "items": {
        "type": "object",
        "properties": {
          "metric": {
            "enum": [
              "frame_p95_ms",
              "peak_memory_mb",
              "mapping_residual_px"
            ]
          },
          "value": {
            "type": "number",
            "minimum": 0
          },
          "unit": {
            "enum": [
              "ms",
              "MB",
              "px"
            ]
          },
          "evidence_id": {
            "type": "string",
            "minLength": 1
          }
        },
        "required": [
          "metric",
          "value",
          "unit",
          "evidence_id"
        ],
        "additionalProperties": false
      },
      "minItems": 0
    },
    "checks": {
      "type": "array",
      "items": {
        "type": "object",
        "properties": {
          "id": {
            "enum": [
              "A01",
              "A02",
              "A03",
              "A04",
              "A05",
              "A06",
              "A07",
              "A08",
              "A09",
              "A10",
              "A11",
              "A12",
              "A13",
              "A14",
              "A15",
              "A16"
            ]
          },
          "status": {
            "enum": [
              "offen",
              "erforscht",
              "spezifiziert",
              "implementiert",
              "validiert"
            ]
          },
          "finding": {
            "type": "string",
            "minLength": 1
          },
          "evidence_ids": {
            "type": "array",
            "items": {
              "type": "string",
              "minLength": 1
            },
            "minItems": 0
          }
        },
        "required": [
          "id",
          "status",
          "finding",
          "evidence_ids"
        ],
        "additionalProperties": false
      },
      "minItems": 16
    }
  },
  "required": [
    "schema_version",
    "kind",
    "run_id",
    "created_utc",
    "synthetic",
    "kit_version",
    "build_revision",
    "sources_revision",
    "mapping_revision",
    "fixture_revision",
    "producer",
    "reviewer",
    "review_ref",
    "user_style_review",
    "evidence",
    "measurements",
    "checks"
  ],
  "additionalProperties": false
}
